title,summary,authors,published,url
"PICT -- A Differentiable, GPU-Accelerated Multi-Block PISO Solver for Simulation-Coupled Learning Tasks in Fluid Dynamics","Despite decades of advancements, the simulation of fluids remains one of the
most challenging areas of in scientific computing. Supported by the necessity
of gradient information in deep learning, differentiable simulators have
emerged as an effective tool for optimization and learning in physics
simulations. In this work, we present our fluid simulator PICT, a
differentiable pressure-implicit solver coded in PyTorch with
Graphics-processing-unit (GPU) support. We first verify the accuracy of both
the forward simulation and our derived gradients in various established
benchmarks like lid-driven cavities and turbulent channel flows before we show
that the gradients provided by our solver can be used to learn complicated
turbulence models in 2D and 3D. We apply both supervised and unsupervised
training regimes using physical priors to match flow statistics. In particular,
we learn a stable sub-grid scale (SGS) model for a 3D turbulent channel flow
purely based on reference statistics. The low-resolution corrector trained with
our solver runs substantially faster than the highly resolved references, while
keeping or even surpassing their accuracy. Finally, we give additional insights
into the physical interpretation of different solver gradients, and motivate a
physically informed regularization technique. To ensure that the full potential
of PICT can be leveraged, it is published as open source:
https://github.com/tum-pbs/PICT.","['Aleksandra Franz', 'Hao Wei', 'Luca Guastoni', 'Nils Thuerey']",2025-05-22,http://arxiv.org/abs/2505.16992v1
MASLab: A Unified and Comprehensive Codebase for LLM-based Multi-Agent Systems,"LLM-based multi-agent systems (MAS) have demonstrated significant potential
in enhancing single LLMs to address complex and diverse tasks in practical
applications. Despite considerable advancements, the field lacks a unified
codebase that consolidates existing methods, resulting in redundant
re-implementation efforts, unfair comparisons, and high entry barriers for
researchers. To address these challenges, we introduce MASLab, a unified,
comprehensive, and research-friendly codebase for LLM-based MAS. (1) MASLab
integrates over 20 established methods across multiple domains, each rigorously
validated by comparing step-by-step outputs with its official implementation.
(2) MASLab provides a unified environment with various benchmarks for fair
comparisons among methods, ensuring consistent inputs and standardized
evaluation protocols. (3) MASLab implements methods within a shared streamlined
structure, lowering the barriers for understanding and extension. Building on
MASLab, we conduct extensive experiments covering 10+ benchmarks and 8 models,
offering researchers a clear and comprehensive view of the current landscape of
MAS methods. MASLab will continue to evolve, tracking the latest developments
in the field, and invite contributions from the broader open-source community.","['Rui Ye', 'Keduan Huang', 'Qimin Wu', 'Yuzhu Cai', 'Tian Jin', 'Xianghe Pang', 'Xiangrui Liu', 'Jiaqi Su', 'Chen Qian', 'Bohan Tang', 'Kaiqu Liang', 'Jiaao Chen', 'Yue Hu', 'Zhenfei Yin', 'Rongye Shi', 'Bo An', 'Yang Gao', 'Wenjun Wu', 'Lei Bai', 'Siheng Chen']",2025-05-22,http://arxiv.org/abs/2505.16988v1
T1: A Tool-Oriented Conversational Dataset for Multi-Turn Agentic Planning,"Large Language Models (LLMs) have demonstrated impressive capabilities as
intelligent agents capable of solving complex problems. However, effective
planning in scenarios involving dependencies between API or tool
calls-particularly in multi-turn conversations-remains a significant challenge.
To address this, we introduce T1, a tool-augmented, multi-domain, multi-turn
conversational dataset specifically designed to capture and manage inter-tool
dependencies across diverse domains. T1 enables rigorous evaluation of agents'
ability to coordinate tool use across nine distinct domains (4 single domain
and 5 multi-domain) with the help of an integrated caching mechanism for both
short- and long-term memory, while supporting dynamic replanning-such as
deciding whether to recompute or reuse cached results. Beyond facilitating
research on tool use and planning, T1 also serves as a benchmark for evaluating
the performance of open-source language models. We present results powered by
T1-Agent, highlighting their ability to plan and reason in complex,
tool-dependent scenarios.","['Amartya Chakraborty', 'Paresh Dashore', 'Nadia Bathaee', 'Anmol Jain', 'Anirban Das', 'Shi-Xiong Zhang', 'Sambit Sahu', 'Milind Naphade', 'Genta Indra Winata']",2025-05-22,http://arxiv.org/abs/2505.16986v1
Extremely Simple Multimodal Outlier Synthesis for Out-of-Distribution Detection and Segmentation,"Out-of-distribution (OOD) detection and segmentation are crucial for
deploying machine learning models in safety-critical applications such as
autonomous driving and robot-assisted surgery. While prior research has
primarily focused on unimodal image data, real-world applications are
inherently multimodal, requiring the integration of multiple modalities for
improved OOD detection. A key challenge is the lack of supervision signals from
unknown data, leading to overconfident predictions on OOD samples. To address
this challenge, we propose Feature Mixing, an extremely simple and fast method
for multimodal outlier synthesis with theoretical support, which can be further
optimized to help the model better distinguish between in-distribution (ID) and
OOD data. Feature Mixing is modality-agnostic and applicable to various
modality combinations. Additionally, we introduce CARLA-OOD, a novel multimodal
dataset for OOD segmentation, featuring synthetic OOD objects across diverse
scenes and weather conditions. Extensive experiments on SemanticKITTI,
nuScenes, CARLA-OOD datasets, and the MultiOOD benchmark demonstrate that
Feature Mixing achieves state-of-the-art performance with a $10 \times$ to $370
\times$ speedup. Our source code and dataset will be available at
https://github.com/mona4399/FeatureMixing.","['Moru Liu', 'Hao Dong', 'Jessica Kelly', 'Olga Fink', 'Mario Trapp']",2025-05-22,http://arxiv.org/abs/2505.16985v1
UFT: Unifying Supervised and Reinforcement Fine-Tuning,"Post-training has demonstrated its importance in enhancing the reasoning
capabilities of large language models (LLMs). The primary post-training methods
can be categorized into supervised fine-tuning (SFT) and reinforcement
fine-tuning (RFT). SFT is efficient and well-suited for small language models,
but it may lead to overfitting and limit the reasoning abilities of larger
models. In contrast, RFT generally yields better generalization but depends
heavily on the strength of the base model. To address the limitations of SFT
and RFT, we propose Unified Fine-Tuning (UFT), a novel post-training paradigm
that unifies SFT and RFT into a single, integrated process. UFT enables the
model to effectively explore solutions while incorporating informative
supervision signals, bridging the gap between memorizing and thinking
underlying existing methods. Notably, UFT outperforms both SFT and RFT in
general, regardless of model sizes. Furthermore, we theoretically prove that
UFT breaks RFT's inherent exponential sample complexity bottleneck, showing for
the first time that unified training can exponentially accelerate convergence
on long-horizon reasoning tasks.","['Mingyang Liu', 'Gabriele Farina', 'Asuman Ozdaglar']",2025-05-22,http://arxiv.org/abs/2505.16984v1
Beyond Correlation: Towards Causal Large Language Model Agents in Biomedicine,"Large Language Models (LLMs) show promise in biomedicine but lack true causal
understanding, relying instead on correlations. This paper envisions causal LLM
agents that integrate multimodal data (text, images, genomics, etc.) and
perform intervention-based reasoning to infer cause-and-effect. Addressing this
requires overcoming key challenges: designing safe, controllable agentic
frameworks; developing rigorous benchmarks for causal evaluation; integrating
heterogeneous data sources; and synergistically combining LLMs with structured
knowledge (KGs) and formal causal inference tools. Such agents could unlock
transformative opportunities, including accelerating drug discovery through
automated hypothesis generation and simulation, enabling personalized medicine
through patient-specific causal models. This research agenda aims to foster
interdisciplinary efforts, bridging causal concepts and foundation models to
develop reliable AI partners for biomedical progress.","['Adib Bazgir', 'Amir Habibdoust Lafmajani', 'Yuwen Zhang']",2025-05-22,http://arxiv.org/abs/2505.16982v1
Know the Ropes: A Heuristic Strategy for LLM-based Multi-Agent System Design,"Single-agent LLMs hit hard limits--finite context, role overload, and brittle
domain transfer. Conventional multi-agent fixes soften those edges yet expose
fresh pains: ill-posed decompositions, fuzzy contracts, and verification
overhead that blunts the gains. We therefore present Know-The-Ropes (KtR), a
framework that converts domain priors into an algorithmic blueprint hierarchy,
in which tasks are recursively split into typed, controller-mediated subtasks,
each solved zero-shot or with the lightest viable boost (e.g.,
chain-of-thought, micro-tune, self-check). Grounded in the No-Free-Lunch
theorem, KtR trades the chase for a universal prompt for disciplined
decomposition. On the Knapsack problem (3-8 items), three GPT-4o-mini agents
raise accuracy from 3% zero-shot to 95% on size-5 instances after patching a
single bottleneck agent. On the tougher Task-Assignment problem (6-15 jobs), a
six-agent o3-mini blueprint hits 100% up to size 10 and 84% on sizes 13-15,
versus 11% zero-shot. Algorithm-aware decomposition plus targeted augmentation
thus turns modest models into reliable collaborators--no ever-larger monoliths
required.","['Zhenkun Li', 'Lingyao Li', 'Shuhang Lin', 'Yongfeng Zhang']",2025-05-22,http://arxiv.org/abs/2505.16979v1
HyGenar: An LLM-Driven Hybrid Genetic Algorithm for Few-Shot Grammar Generation,"Grammar plays a critical role in natural language processing and text/code
generation by enabling the definition of syntax, the creation of parsers, and
guiding structured outputs. Although large language models (LLMs) demonstrate
impressive capabilities across domains, their ability to infer and generate
grammars has not yet been thoroughly explored. In this paper, we aim to study
and improve the ability of LLMs for few-shot grammar generation, where grammars
are inferred from sets of a small number of positive and negative examples and
generated in Backus-Naur Form. To explore this, we introduced a novel dataset
comprising 540 structured grammar generation challenges, devised 6 metrics, and
evaluated 8 various LLMs against it. Our findings reveal that existing LLMs
perform sub-optimally in grammar generation. To address this, we propose an
LLM-driven hybrid genetic algorithm, namely HyGenar, to optimize grammar
generation. HyGenar achieves substantial improvements in both the syntactic and
semantic correctness of generated grammars across LLMs.","['Weizhi Tang', 'Yixuan Li', 'Chris Sypherd', 'Elizabeth Polgreen', 'Vaishak Belle']",2025-05-22,http://arxiv.org/abs/2505.16978v1
"CASS: Nvidia to AMD Transpilation with Data, Models, and Benchmark","We introduce \texttt{CASS}, the first large-scale dataset and model suite for
cross-architecture GPU code transpilation, targeting both source-level
(CUDA~$\leftrightarrow$~HIP) and assembly-level (Nvidia
SASS~$\leftrightarrow$~AMD RDNA3) translation. The dataset comprises 70k
verified code pairs across host and device, addressing a critical gap in
low-level GPU code portability. Leveraging this resource, we train the
\texttt{CASS} family of domain-specific language models, achieving 95\% source
translation accuracy and 37.5\% assembly translation accuracy, substantially
outperforming commercial baselines such as GPT-4o, Claude, and Hipify. Our
generated code matches native performance in over 85\% of test cases,
preserving runtime and memory behavior. To support rigorous evaluation, we
introduce \texttt{CASS-Bench}, a curated benchmark spanning 16 GPU domains with
ground-truth execution. All data, models, and evaluation tools are released as
open source to foster progress in GPU compiler tooling, binary compatibility,
and LLM-guided hardware translation. Dataset and benchmark are on
\href{https://huggingface.co/datasets/MBZUAI/cass}{\textcolor{blue}{HuggingFace}},
with code at
\href{https://github.com/GustavoStahl/CASS}{\textcolor{blue}{GitHub}}.","['Ahmed Heakl', 'Sarim Hashmi', 'Gustavo Bertolo Stahl', 'Seung Hun Eddie Han', 'Salman Khan', 'Abdulrahman Mahmoud']",2025-05-22,http://arxiv.org/abs/2505.16968v1
Fixing Data That Hurts Performance: Cascading LLMs to Relabel Hard Negatives for Robust Information Retrieval,"Training robust retrieval and reranker models typically relies on large-scale
retrieval datasets; for example, the BGE collection contains 1.6 million
query-passage pairs sourced from various data sources. However, we find that
certain datasets can negatively impact model effectiveness -- pruning 8 out of
15 datasets from the BGE collection reduces the training set size by
2.35$\times$ and increases nDCG@10 on BEIR by 1.0 point. This motivates a
deeper examination of training data quality, with a particular focus on ""false
negatives"", where relevant passages are incorrectly labeled as irrelevant. We
propose a simple, cost-effective approach using cascading LLM prompts to
identify and relabel hard negatives. Experimental results show that relabeling
false negatives with true positives improves both E5 (base) and Qwen2.5-7B
retrieval models by 0.7-1.4 nDCG@10 on BEIR and by 1.7-1.8 nDCG@10 on zero-shot
AIR-Bench evaluation. Similar gains are observed for rerankers fine-tuned on
the relabeled data, such as Qwen2.5-3B on BEIR. The reliability of the
cascading design is further supported by human annotation results, where we
find judgment by GPT-4o shows much higher agreement with humans than
GPT-4o-mini.","['Nandan Thakur', 'Crystina Zhang', 'Xueguang Ma', 'Jimmy Lin']",2025-05-22,http://arxiv.org/abs/2505.16967v1
BP-Seg: A graphical model approach to unsupervised and non-contiguous text segmentation using belief propagation,"Text segmentation based on the semantic meaning of sentences is a fundamental
task with broad utility in many downstream applications. In this paper, we
propose a graphical model-based unsupervised learning approach, named BP-Seg
for efficient text segmentation. Our method not only considers local coherence,
capturing the intuition that adjacent sentences are often more related, but
also effectively groups sentences that are distant in the text yet semantically
similar. This is achieved through belief propagation on the carefully
constructed graphical models. Experimental results on both an illustrative
example and a dataset with long-form documents demonstrate that our method
performs favorably compared to competing approaches.","['Fengyi Li', 'Kayhan Behdin', 'Natesh Pillai', 'Xiaofeng Wang', 'Zhipeng Wang', 'Ercan Yildiz']",2025-05-22,http://arxiv.org/abs/2505.16965v1
Bigger Isn't Always Memorizing: Early Stopping Overparameterized Diffusion Models,"Diffusion probabilistic models have become a cornerstone of modern generative
AI, yet the mechanisms underlying their generalization remain poorly
understood. In fact, if these models were perfectly minimizing their training
loss, they would just generate data belonging to their training set, i.e.,
memorize, as empirically found in the overparameterized regime. We revisit this
view by showing that, in highly overparameterized diffusion models,
generalization in natural data domains is progressively achieved during
training before the onset of memorization. Our results, ranging from image to
language diffusion models, systematically support the empirical law that
memorization time is proportional to the dataset size. Generalization vs.
memorization is then best understood as a competition between time scales. We
show that this phenomenology is recovered in diffusion models learning a simple
probabilistic context-free grammar with random rules, where generalization
corresponds to the hierarchical acquisition of deeper grammar rules as training
time grows, and the generalization cost of early stopping can be characterized.
We summarize these results in a phase diagram. Overall, our results support
that a principled early-stopping criterion - scaling with dataset size - can
effectively optimize generalization while avoiding memorization, with direct
implications for hyperparameter transfer and privacy-sensitive applications.","['Alessandro Favero', 'Antonio Sclocchi', 'Matthieu Wyart']",2025-05-22,http://arxiv.org/abs/2505.16959v1
"Invisible Prompts, Visible Threats: Malicious Font Injection in External Resources for Large Language Models","Large Language Models (LLMs) are increasingly equipped with capabilities of
real-time web search and integrated with protocols like Model Context Protocol
(MCP). This extension could introduce new security vulnerabilities. We present
a systematic investigation of LLM vulnerabilities to hidden adversarial prompts
through malicious font injection in external resources like webpages, where
attackers manipulate code-to-glyph mapping to inject deceptive content which
are invisible to users. We evaluate two critical attack scenarios: (1)
""malicious content relay"" and (2) ""sensitive data leakage"" through MCP-enabled
tools. Our experiments reveal that indirect prompts with injected malicious
font can bypass LLM safety mechanisms through external resources, achieving
varying success rates based on data sensitivity and prompt design. Our research
underscores the urgent need for enhanced security measures in LLM deployments
when processing external content.","['Junjie Xiong', 'Changjia Zhu', 'Shuhang Lin', 'Chong Zhang', 'Yongfeng Zhang', 'Yao Liu', 'Lingyao Li']",2025-05-22,http://arxiv.org/abs/2505.16957v1
A Comprehensive Evaluation of Contemporary ML-Based Solvers for Combinatorial Optimization,"Machine learning (ML) has demonstrated considerable potential in supporting
model design and optimization for combinatorial optimization (CO) problems.
However, much of the progress to date has been evaluated on small-scale,
synthetic datasets, raising concerns about the practical effectiveness of
ML-based solvers in real-world, large-scale CO scenarios. Additionally, many
existing CO benchmarks lack sufficient training data, limiting their utility
for evaluating data-driven approaches. To address these limitations, we
introduce FrontierCO, a comprehensive benchmark that covers eight canonical CO
problem types and evaluates 16 representative ML-based solvers--including graph
neural networks and large language model (LLM) agents. FrontierCO features
challenging instances drawn from industrial applications and frontier CO
research, offering both realistic problem difficulty and abundant training
data. Our empirical results provide critical insights into the strengths and
limitations of current ML methods, helping to guide more robust and practically
relevant advances at the intersection of machine learning and combinatorial
optimization. Our data is available at
https://huggingface.co/datasets/CO-Bench/FrontierCO.","['Shengyu Feng', 'Weiwei Sun', 'Shanda Li', 'Ameet Talwalkar', 'Yiming Yang']",2025-05-22,http://arxiv.org/abs/2505.16952v1
ICYM2I: The illusion of multimodal informativeness under missingness,"Multimodal learning is of continued interest in artificial intelligence-based
applications, motivated by the potential information gain from combining
different types of data. However, modalities collected and curated during
development may differ from the modalities available at deployment due to
multiple factors including cost, hardware failure, or -- as we argue in this
work -- the perceived informativeness of a given modality. Na{\""i}ve estimation
of the information gain associated with including an additional modality
without accounting for missingness may result in improper estimates of that
modality's value in downstream tasks. Our work formalizes the problem of
missingness in multimodal learning and demonstrates the biases resulting from
ignoring this process. To address this issue, we introduce ICYM2I (In Case You
Multimodal Missed It), a framework for the evaluation of predictive performance
and information gain under missingness through inverse probability
weighting-based correction. We demonstrate the importance of the proposed
adjustment to estimate information gain under missingness on synthetic,
semi-synthetic, and real-world medical datasets.","['Young Sang Choi', 'Vincent Jeanselme', 'Pierre Elias', 'Shalmali Joshi']",2025-05-22,http://arxiv.org/abs/2505.16953v1
Bottlenecked Transformers: Periodic KV Cache Abstraction for Generalised Reasoning,"Despite their impressive capabilities, Large Language Models struggle with
generalisation beyond their training distribution, often exhibiting
sophisticated pattern interpolation rather than true abstract reasoning
(extrapolation). In this work, we approach this limitation through the lens of
Information Bottleneck (IB) theory, which posits that model generalisation
emerges from an optimal balance between input compression and retention of
predictive information in latent representations. We prove using IB theory that
decoder-only Transformers are inherently constrained in their ability to form
task-optimal sequence representations. We then use this result to demonstrate
that periodic global transformation of the internal sequence-level
representations (KV cache) is a necessary computational step for improving
Transformer generalisation in reasoning tasks. Based on these theoretical
insights, we propose a modification to the Transformer architecture, in the
form of an additional module that globally rewrites the KV cache at periodic
intervals, shifting its capacity away from memorising input prefixes and toward
encoding features most useful for predicting future tokens. Our model delivers
substantial gains on mathematical reasoning benchmarks, outperforming both
vanilla Transformers with up to 3.5x more parameters, as well as
heuristic-driven pruning mechanisms for cache compression. Our approach can be
seen as a principled generalisation of existing KV-cache compression methods;
whereas such methods focus solely on compressing input representations, they
often do so at the expense of retaining predictive information, and thus their
capabilities are inherently bounded by those of an unconstrained model. This
establishes a principled framework to manipulate Transformer memory using
information theory, addressing fundamental reasoning limitations that scaling
alone cannot overcome.","['Adnan Oomerjee', 'Zafeirios Fountas', 'Zhongwei Yu', 'Haitham Bou-Ammar', 'Jun Wang']",2025-05-22,http://arxiv.org/abs/2505.16950v1
MixAT: Combining Continuous and Discrete Adversarial Training for LLMs,"Despite recent efforts in Large Language Models (LLMs) safety and alignment,
current adversarial attacks on frontier LLMs are still able to force harmful
generations consistently. Although adversarial training has been widely studied
and shown to significantly improve the robustness of traditional machine
learning models, its strengths and weaknesses in the context of LLMs are less
understood. Specifically, while existing discrete adversarial attacks are
effective at producing harmful content, training LLMs with concrete adversarial
prompts is often computationally expensive, leading to reliance on continuous
relaxations. As these relaxations do not correspond to discrete input tokens,
such latent training methods often leave models vulnerable to a diverse set of
discrete attacks. In this work, we aim to bridge this gap by introducing MixAT,
a novel method that combines stronger discrete and faster continuous attacks
during training. We rigorously evaluate MixAT across a wide spectrum of
state-of-the-art attacks, proposing the At Least One Attack Success Rate
(ALO-ASR) metric to capture the worst-case vulnerability of models. We show
MixAT achieves substantially better robustness (ALO-ASR < 20%) compared to
prior defenses (ALO-ASR > 50%), while maintaining a runtime comparable to
methods based on continuous relaxations. We further analyze MixAT in realistic
deployment settings, exploring how chat templates, quantization, low-rank
adapters, and temperature affect both adversarial training and evaluation,
revealing additional blind spots in current methodologies. Our results
demonstrate that MixAT's discrete-continuous defense offers a principled and
superior robustness-accuracy tradeoff with minimal computational overhead,
highlighting its promise for building safer LLMs. We provide our code and
models at https://github.com/insait-institute/MixAT.","['Csaba Dékány', 'Stefan Balauca', 'Robin Staab', 'Dimitar I. Dimitrov', 'Martin Vechev']",2025-05-22,http://arxiv.org/abs/2505.16947v1
