title,summary,authors,published,url
NY Real Estate Racial Equity Analysis via Applied Machine Learning,"This study analyzes tract-level real estate ownership patterns in New York
State (NYS) and New York City (NYC) to uncover racial disparities. We use an
advanced race/ethnicity imputation model (LSTM+Geo with XGBoost filtering,
validated at 89.2% accuracy) to compare the predicted racial composition of
property owners to the resident population from census data. We examine both a
Full Model (statewide) and a Name-Only LSTM Model (NYC) to assess how
incorporating geospatial context affects our predictions and disparity
estimates. The results reveal significant inequities: White individuals hold a
disproportionate share of properties and property value relative to their
population, while Black, Hispanic, and Asian communities are underrepresented
as property owners. These disparities are most pronounced in minority-majority
neighborhoods, where ownership is predominantly White despite a predominantly
non-White population. Corporate ownership (LLCs, trusts, etc.) exacerbates
these gaps by reducing owner-occupied opportunities in urban minority
communities. We provide a breakdown of ownership vs. population by race for
majority-White, -Black, -Hispanic, and -Asian tracts, identify those with
extreme ownership disparities, and compare patterns in urban, suburban, and
rural contexts. The findings underscore persistent racial inequity in property
ownership, reflecting broader historical and socio-economic forces, and
highlight the importance of data-driven approaches to address these issues.","['Sanjana Chalavadi', 'Andrei Pastor', 'Terry Leitch']",2025-05-22,http://arxiv.org/abs/2505.16946v1
AGENTIF: Benchmarking Instruction Following of Large Language Models in Agentic Scenarios,"Large Language Models (LLMs) have demonstrated advanced capabilities in
real-world agentic applications. Growing research efforts aim to develop
LLM-based agents to address practical demands, introducing a new challenge:
agentic scenarios often involve lengthy instructions with complex constraints,
such as extended system prompts and detailed tool specifications. While
adherence to such instructions is crucial for agentic applications, whether
LLMs can reliably follow them remains underexplored. In this paper, we
introduce AgentIF, the first benchmark for systematically evaluating LLM
instruction following ability in agentic scenarios. AgentIF features three key
characteristics: (1) Realistic, constructed from 50 real-world agentic
applications. (2) Long, averaging 1,723 words with a maximum of 15,630 words.
(3) Complex, averaging 11.9 constraints per instruction, covering diverse
constraint types, such as tool specifications and condition constraints. To
construct AgentIF, we collect 707 human-annotated instructions across 50
agentic tasks from industrial application agents and open-source agentic
systems. For each instruction, we annotate the associated constraints and
corresponding evaluation metrics, including code-based evaluation, LLM-based
evaluation, and hybrid code-LLM evaluation. We use AgentIF to systematically
evaluate existing advanced LLMs. We observe that current models generally
perform poorly, especially in handling complex constraint structures and tool
specifications. We further conduct error analysis and analytical experiments on
instruction length and meta constraints, providing some findings about the
failure modes of existing LLMs. We have released the code and data to
facilitate future research.","['Yunjia Qi', 'Hao Peng', 'Xiaozhi Wang', 'Amy Xin', 'Youfeng Liu', 'Bin Xu', 'Lei Hou', 'Juanzi Li']",2025-05-22,http://arxiv.org/abs/2505.16944v1
Efficient Correlation Volume Sampling for Ultra-High-Resolution Optical Flow Estimation,"Recent optical flow estimation methods often employ local cost sampling from
a dense all-pairs correlation volume. This results in quadratic computational
and memory complexity in the number of pixels. Although an alternative
memory-efficient implementation with on-demand cost computation exists, this is
slower in practice and therefore prior methods typically process images at
reduced resolutions, missing fine-grained details.
  To address this, we propose a more efficient implementation of the all-pairs
correlation volume sampling, still matching the exact mathematical operator as
defined by RAFT. Our approach outperforms on-demand sampling by up to 90% while
maintaining low memory usage, and performs on par with the default
implementation with up to 95% lower memory usage. As cost sampling makes up a
significant portion of the overall runtime, this can translate to up to 50%
savings for the total end-to-end model inference in memory-constrained
environments. Our evaluation of existing methods includes an 8K
ultra-high-resolution dataset and an additional inference-time modification of
the recent SEA-RAFT method. With this, we achieve state-of-the-art results at
high resolutions both in accuracy and efficiency.","['Karlis Martins Briedis', 'Markus Gross', 'Christopher Schroers']",2025-05-22,http://arxiv.org/abs/2505.16942v1
FoMoH: A clinically meaningful foundation model evaluation for structured electronic health records,"Foundation models hold significant promise in healthcare, given their
capacity to extract meaningful representations independent of downstream tasks.
This property has enabled state-of-the-art performance across several clinical
applications trained on structured electronic health record (EHR) data, even in
settings with limited labeled data, a prevalent challenge in healthcare.
However, there is little consensus on these models' potential for clinical
utility due to the lack of desiderata of comprehensive and meaningful tasks and
sufficiently diverse evaluations to characterize the benefit over conventional
supervised learning. To address this gap, we propose a suite of clinically
meaningful tasks spanning patient outcomes, early prediction of acute and
chronic conditions, including desiderata for robust evaluations. We evaluate
state-of-the-art foundation models on EHR data consisting of 5 million patients
from Columbia University Irving Medical Center (CUMC), a large urban academic
medical center in New York City, across 14 clinically relevant tasks. We
measure overall accuracy, calibration, and subpopulation performance to surface
tradeoffs based on the choice of pre-training, tokenization, and data
representation strategies. Our study aims to advance the empirical evaluation
of structured EHR foundation models and guide the development of future
healthcare foundation models.","['Chao Pang', 'Vincent Jeanselme', 'Young Sang Choi', 'Xinzhuo Jiang', 'Zilin Jing', 'Aparajita Kashyap', 'Yuta Kobayashi', 'Yanwei Li', 'Florent Pollet', 'Karthik Natarajan', 'Shalmali Joshi']",2025-05-22,http://arxiv.org/abs/2505.16941v1
NovelSeek: When Agent Becomes the Scientist -- Building Closed-Loop System from Hypothesis to Verification,"Artificial Intelligence (AI) is accelerating the transformation of scientific
research paradigms, not only enhancing research efficiency but also driving
innovation. We introduce NovelSeek, a unified closed-loop multi-agent framework
to conduct Autonomous Scientific Research (ASR) across various scientific
research fields, enabling researchers to tackle complicated problems in these
fields with unprecedented speed and precision. NovelSeek highlights three key
advantages: 1) Scalability: NovelSeek has demonstrated its versatility across
12 scientific research tasks, capable of generating innovative ideas to enhance
the performance of baseline code. 2) Interactivity: NovelSeek provides an
interface for human expert feedback and multi-agent interaction in automated
end-to-end processes, allowing for the seamless integration of domain expert
knowledge. 3) Efficiency: NovelSeek has achieved promising performance gains in
several scientific fields with significantly less time cost compared to human
efforts. For instance, in reaction yield prediction, it increased from 27.6% to
35.4% in just 12 hours; in enhancer activity prediction, accuracy rose from
0.52 to 0.79 with only 4 hours of processing; and in 2D semantic segmentation,
precision advanced from 78.8% to 81.0% in a mere 30 hours.","['NovelSeek Team', 'Bo Zhang', 'Shiyang Feng', 'Xiangchao Yan', 'Jiakang Yuan', 'Zhiyin Yu', 'Xiaohan He', 'Songtao Huang', 'Shaowei Hou', 'Zheng Nie', 'Zhilong Wang', 'Jinyao Liu', 'Runmin Ma', 'Tianshuo Peng', 'Peng Ye', 'Dongzhan Zhou', 'Shufei Zhang', 'Xiaosong Wang', 'Yilan Zhang', 'Meng Li', 'Zhongying Tu', 'Xiangyu Yue', 'Wangli Ouyang', 'Bowen Zhou', 'Lei Bai']",2025-05-22,http://arxiv.org/abs/2505.16938v1
SPAR: Self-supervised Placement-Aware Representation Learning for Multi-Node IoT Systems,"This work develops the underpinnings of self-supervised placement-aware
representation learning given spatially-distributed (multi-view and multimodal)
sensor observations, motivated by the need to represent external environmental
state in multi-sensor IoT systems in a manner that correctly distills spatial
phenomena from the distributed multi-vantage observations. The objective of
sensing in IoT systems is, in general, to collectively represent an externally
observed environment given multiple vantage points from which sensory
observations occur. Pretraining of models that help interpret sensor data must
therefore encode the relation between signals observed by sensors and the
observers' vantage points in order to attain a representation that encodes the
observed spatial phenomena in a manner informed by the specific placement of
the measuring instruments, while allowing arbitrary placement. The work
significantly advances self-supervised model pretraining from IoT signals
beyond current solutions that often overlook the distinctive spatial nature of
IoT data. Our framework explicitly learns the dependencies between measurements
and geometric observer layouts and structural characteristics, guided by a core
design principle: the duality between signals and observer positions. We
further provide theoretical analyses from the perspectives of information
theory and occlusion-invariant representation learning to offer insight into
the rationale behind our design. Experiments on three real-world
datasets--covering vehicle monitoring, human activity recognition, and
earthquake localization--demonstrate the superior generalizability and
robustness of our method across diverse modalities, sensor placements,
application-level inference tasks, and spatial scales.","['Yizhuo Chen', 'Tianchen Wang', 'You Lyu', 'Yanlan Hu', 'Jinyang Li', 'Tomoyoshi Kimura', 'Hongjue Zhao', 'Yigong Hu', 'Denizhan Kara', 'Tarek Abdelzaher']",2025-05-22,http://arxiv.org/abs/2505.16936v1
LLaDA-V: Large Language Diffusion Models with Visual Instruction Tuning,"In this work, we introduce LLaDA-V, a purely diffusion-based Multimodal Large
Language Model (MLLM) that integrates visual instruction tuning with masked
diffusion models, representing a departure from the autoregressive paradigms
dominant in current multimodal approaches. Built upon LLaDA, a representative
large language diffusion model, LLaDA-V incorporates a vision encoder and MLP
connector that projects visual features into the language embedding space,
enabling effective multimodal alignment. Our empirical investigation reveals
several intriguing results: First, LLaDA-V demonstrates promising multimodal
performance despite its language model being weaker on purely textual tasks
than counterparts like LLaMA3-8B and Qwen2-7B. When trained on the same
instruction data, LLaDA-V is highly competitive to LLaMA3-V across multimodal
tasks with better data scalability. It also narrows the performance gap to
Qwen2-VL, suggesting the effectiveness of its architecture for multimodal
tasks. Second, LLaDA-V achieves state-of-the-art performance in multimodal
understanding compared to existing hybrid autoregressive-diffusion and purely
diffusion-based MLLMs. Our findings suggest that large language diffusion
models show promise in multimodal contexts and warrant further investigation in
future research. Project page and codes:
https://ml-gsai.github.io/LLaDA-V-demo/.","['Zebin You', 'Shen Nie', 'Xiaolu Zhang', 'Jun Hu', 'Jun Zhou', 'Zhiwu Lu', 'Ji-Rong Wen', 'Chongxuan Li']",2025-05-22,http://arxiv.org/abs/2505.16933v1
The Polar Express: Optimal Matrix Sign Methods and Their Application to the Muon Algorithm,"Computing the polar decomposition and the related matrix sign function, has
been a well-studied problem in numerical analysis for decades. More recently,
it has emerged as an important subroutine in deep learning, particularly within
the Muon optimization framework. However, the requirements in this setting
differ significantly from those of traditional numerical analysis. In deep
learning, methods must be highly efficient and GPU-compatible, but high
accuracy is often unnecessary. As a result, classical algorithms like
Newton-Schulz (which suffers from slow initial convergence) and methods based
on rational functions (which rely on QR decompositions or matrix inverses) are
poorly suited to this context. In this work, we introduce Polar Express, a
GPU-friendly algorithm for computing the polar decomposition. Like classical
polynomial methods such as Newton-Schulz, our approach uses only matrix-matrix
multiplications, making it GPU-compatible. Motivated by earlier work of Chen &
Chow and Nakatsukasa & Freund, Polar Express adapts the polynomial update rule
at each iteration by solving a minimax optimization problem, and we prove that
it enjoys a strong worst-case optimality guarantee. This property ensures both
rapid early convergence and fast asymptotic convergence. We also address
finite-precision issues, making it stable in bfloat16 in practice. We apply
Polar Express within the Muon optimization framework and show consistent
improvements in validation loss on large-scale models such as GPT-2,
outperforming recent alternatives across a range of learning rates.","['Noah Amsel', 'David Persson', 'Christopher Musco', 'Robert Gower']",2025-05-22,http://arxiv.org/abs/2505.16932v1
"Beyond Needle(s) in the Embodied Haystack: Environment, Architecture, and Training Considerations for Long Context Reasoning","We introduce $\infty$-THOR, a new framework for long-horizon embodied tasks
that advances long-context understanding in embodied AI. $\infty$-THOR
provides: (1) a generation framework for synthesizing scalable, reproducible,
and unlimited long-horizon trajectories; (2) a novel embodied QA task,
Needle(s) in the Embodied Haystack, where multiple scattered clues across
extended trajectories test agents' long-context reasoning ability; and (3) a
long-horizon dataset and benchmark suite featuring complex tasks that span
hundreds of environment steps, each paired with ground-truth action sequences.
To enable this capability, we explore architectural adaptations, including
interleaved Goal-State-Action modeling, context extension techniques, and
Context Parallelism, to equip LLM-based agents for extreme long-context
reasoning and interaction. Experimental results and analyses highlight the
challenges posed by our benchmark and provide insights into training strategies
and model behaviors under long-horizon conditions. Our work provides a
foundation for the next generation of embodied AI systems capable of robust,
long-term reasoning and planning.","['Bosung Kim', 'Prithviraj Ammanabrolu']",2025-05-22,http://arxiv.org/abs/2505.16928v1
Latent Principle Discovery for Language Model Self-Improvement,"When language model (LM) users aim to improve the quality of its generations,
it is crucial to specify concrete behavioral attributes that the model should
strive to reflect. However, curating such principles across many domains, even
non-exhaustively, requires a labor-intensive annotation process. To automate
this process, we propose eliciting these latent attributes guiding model
reasoning towards human-preferred responses by explicitly modeling them in a
self-correction setting. Our approach mines new principles from the LM itself
and compresses the discovered elements to an interpretable set via clustering.
Specifically, we employ an approximation of posterior-regularized Monte Carlo
Expectation-Maximization to both identify a condensed set of the most effective
latent principles and teach the LM to strategically invoke them in order to
intrinsically refine its responses. We demonstrate that bootstrapping our
algorithm over multiple iterations enables smaller language models (7-8B
parameters) to self-improve, achieving +8-10% in AlpacaEval win-rate, an
average of +0.3 on MT-Bench, and +19-23% in principle-following win-rate on
IFEval. We also show that clustering the principles yields interpretable and
diverse model-generated constitutions while retaining model performance. The
gains our method achieves highlight the potential of automated,
principle-driven post-training recipes toward continual self-improvement.","['Keshav Ramji', 'Tahira Naseem', 'Ramón Fernandez Astudillo']",2025-05-22,http://arxiv.org/abs/2505.16927v1
Risk-Averse Reinforcement Learning with Itakura-Saito Loss,"Risk-averse reinforcement learning finds application in various high-stakes
fields. Unlike classical reinforcement learning, which aims to maximize
expected returns, risk-averse agents choose policies that minimize risk,
occasionally sacrificing expected value. These preferences can be framed
through utility theory. We focus on the specific case of the exponential
utility function, where we can derive the Bellman equations and employ various
reinforcement learning algorithms with few modifications. However, these
methods suffer from numerical instability due to the need for exponent
computation throughout the process. To address this, we introduce a numerically
stable and mathematically sound loss function based on the Itakura-Saito
divergence for learning state-value and action-value functions. We evaluate our
proposed loss function against established alternatives, both theoretically and
empirically. In the experimental section, we explore multiple financial
scenarios, some with known analytical solutions, and show that our loss
function outperforms the alternatives.","['Igor Udovichenko', 'Olivier Croissant', 'Anita Toleutaeva', 'Evgeny Burnaev', 'Alexander Korotin']",2025-05-22,http://arxiv.org/abs/2505.16925v1
TULiP: Test-time Uncertainty Estimation via Linearization and Weight Perturbation,"A reliable uncertainty estimation method is the foundation of many modern
out-of-distribution (OOD) detectors, which are critical for safe deployments of
deep learning models in the open world. In this work, we propose TULiP, a
theoretically-driven post-hoc uncertainty estimator for OOD detection. Our
approach considers a hypothetical perturbation applied to the network before
convergence. Based on linearized training dynamics, we bound the effect of such
perturbation, resulting in an uncertainty score computable by perturbing model
parameters. Ultimately, our approach computes uncertainty from a set of sampled
predictions. We visualize our bound on synthetic regression and classification
datasets. Furthermore, we demonstrate the effectiveness of TULiP using
large-scale OOD detection benchmarks for image classification. Our method
exhibits state-of-the-art performance, particularly for near-distribution
samples.","['Yuhui Zhang', 'Dongshen Wu', 'Yuichiro Wada', 'Takafumi Kanamori']",2025-05-22,http://arxiv.org/abs/2505.16923v1
Scalable and Interpretable Contextual Bandits: A Literature Review and Retail Offer Prototype,"This paper presents a concise review of Contextual Multi-Armed Bandit (CMAB)
methods and introduces an experimental framework for scalable, interpretable
offer selection, addressing the challenge of fast-changing offers. The approach
models context at the product category level, allowing offers to span multiple
categories and enabling knowledge transfer across similar offers. This improves
learning efficiency and generalization in dynamic environments. The framework
extends standard CMAB methodology to support multi-category contexts, and
achieves scalability through efficient feature engineering and modular design.
Advanced features such as MPG (Member Purchase Gap) and MF (Matrix
Factorization) capture nuanced user-offer interactions, with implementation in
Python for practical deployment.
  A key contribution is interpretability at scale: logistic regression models
yield transparent weight vectors, accessible via a large language model (LLM)
interface for real-time, user-level tracking and explanation of evolving
preferences. This enables the generation of detailed member profiles and
identification of behavioral patterns, supporting personalized offer
optimization and enhancing trust in automated decisions. By situating our
prototype alongside established paradigms like Generalized Linear Models and
Thompson Sampling, we demonstrate its value for both research and real-world
CMAB applications.","['Nikola Tankovic', 'Robert Sajina']",2025-05-22,http://arxiv.org/abs/2505.16918v1
DetailMaster: Can Your Text-to-Image Model Handle Long Prompts?,"While recent text-to-image (T2I) models show impressive capabilities in
synthesizing images from brief descriptions, their performance significantly
degrades when confronted with long, detail-intensive prompts required in
professional applications. We present DetailMaster, the first comprehensive
benchmark specifically designed to evaluate T2I models' systematical abilities
to handle extended textual inputs that contain complex compositional
requirements. Our benchmark introduces four critical evaluation dimensions:
Character Attributes, Structured Character Locations, Multi-Dimensional Scene
Attributes, and Explicit Spatial/Interactive Relationships. The benchmark
comprises long and detail-rich prompts averaging 284.89 tokens, with high
quality validated by expert annotators. Evaluation on 7 general-purpose and 5
long-prompt-optimized T2I models reveals critical performance limitations:
state-of-the-art models achieve merely ~50% accuracy in key dimensions like
attribute binding and spatial reasoning, while all models showing progressive
performance degradation as prompt length increases. Our analysis highlights
systemic failures in structural comprehension and detail overload handling,
motivating future research into architectures with enhanced compositional
reasoning. We open-source the dataset, data curation code, and evaluation tools
to advance detail-rich T2I generation and enable broad applications that would
otherwise be infeasible due to the lack of a dedicated benchmark.","['Qirui Jiao', 'Daoyuan Chen', 'Yilun Huang', 'Xika Lin', 'Ying Shen', 'Yaliang Li']",2025-05-22,http://arxiv.org/abs/2505.16915v1
Active Speech Enhancement: Active Speech Denoising Decliping and Deveraberation,"We introduce a new paradigm for active sound modification: Active Speech
Enhancement (ASE). While Active Noise Cancellation (ANC) algorithms focus on
suppressing external interference, ASE goes further by actively shaping the
speech signal -- both attenuating unwanted noise components and amplifying
speech-relevant frequencies -- to improve intelligibility and perceptual
quality. To enable this, we propose a novel Transformer-Mamba-based
architecture, along with a task-specific loss function designed to jointly
optimize interference suppression and signal enrichment. Our method outperforms
existing baselines across multiple speech processing tasks -- including
denoising, dereverberation, and declipping -- demonstrating the effectiveness
of active, targeted modulation in challenging acoustic environments.","['Ofir Yaish', 'Yehuda Mishaly', 'Eliya Nachmani']",2025-05-22,http://arxiv.org/abs/2505.16911v1
Unsupervised Prompting for Graph Neural Networks,"Prompt tuning methods for Graph Neural Networks (GNNs) have become popular to
address the semantic gap between pre-training and fine-tuning steps. However,
existing GNN prompting methods rely on labeled data and involve lightweight
fine-tuning for downstream tasks. Meanwhile, in-context learning methods for
Large Language Models (LLMs) have shown promising performance with no parameter
updating and no or minimal labeled data. Inspired by these approaches, in this
work, we first introduce a challenging problem setup to evaluate GNN prompting
methods. This setup encourages a prompting function to enhance a pre-trained
GNN's generalization to a target dataset under covariate shift without updating
the GNN's parameters and with no labeled data. Next, we propose a fully
unsupervised prompting method based on consistency regularization through
pseudo-labeling. We use two regularization techniques to align the prompted
graphs' distribution with the original data and reduce biased predictions.
Through extensive experiments under our problem setting, we demonstrate that
our unsupervised approach outperforms the state-of-the-art prompting methods
that have access to labels.","['Peyman Baghershahi', 'Sourav Medya']",2025-05-22,http://arxiv.org/abs/2505.16903v1
